{
  "$schema": "https://json-schema.org/draft/2020-12/schema",
  "$id": "gtm-handoff-brief/1",
  "title": "GTMHandoffBrief response",
  "type": "object",
  "additionalProperties": false,
  "required": [
    "contract_version",
    "packet_id",
    "outcome",
    "refusal_reason",
    "missing_fields",
    "brief",
    "cited_source_ids"
  ],
  "properties": {
    "contract_version": {
      "const": "gtm-handoff-brief/1"
    },
    "packet_id": {
      "type": "string",
      "pattern": "^pkt-"
    },
    "outcome": {
      "enum": [
        "draft",
        "refused"
      ]
    },
    "refusal_reason": {
      "enum": [
        null,
        "missing_evidence",
        "ownership_conflict",
        "unknown_territory",
        "duplicate_review",
        "not_qualified",
        "insufficient_context"
      ]
    },
    "missing_fields": {
      "type": "array",
      "items": {
        "type": "string"
      }
    },
    "cited_source_ids": {
      "type": "array",
      "items": {
        "type": "string"
      }
    },
    "brief": {
      "oneOf": [
        {
          "type": "null"
        },
        {
          "type": "object",
          "additionalProperties": false,
          "required": [
            "headline",
            "owner_id",
            "context",
            "suggested_first_touch",
            "open_questions"
          ],
          "properties": {
            "headline": {
              "type": "string",
              "minLength": 1,
              "maxLength": 200
            },
            "owner_id": {
              "type": "string"
            },
            "context": {
              "type": "array",
              "minItems": 1,
              "items": {
                "type": "object",
                "additionalProperties": false,
                "required": [
                  "text",
                  "source_ids"
                ],
                "properties": {
                  "text": {
                    "type": "string"
                  },
                  "source_ids": {
                    "type": "array",
                    "minItems": 1,
                    "items": {
                      "type": "string"
                    }
                  }
                }
              }
            },
            "suggested_first_touch": {
              "type": "string",
              "maxLength": 1200
            },
            "open_questions": {
              "type": "array",
              "items": {
                "type": "string"
              }
            }
          }
        }
      ]
    }
  },
  "allOf": [
    {
      "if": {
        "properties": {
          "outcome": {
            "const": "refused"
          }
        }
      },
      "then": {
        "properties": {
          "brief": {
            "type": "null"
          },
          "refusal_reason": {
            "type": "string"
          }
        }
      }
    },
    {
      "if": {
        "properties": {
          "outcome": {
            "const": "draft"
          }
        }
      },
      "then": {
        "properties": {
          "brief": {
            "type": "object"
          },
          "refusal_reason": {
            "type": "null"
          }
        }
      }
    }
  ],
  "x-semantic-rules": [
    "packet_id must equal the packet's packet_id.",
    "Every cited source_id must appear in packet.evidence[].source_id.",
    "If packet_status is not ready, outcome must be refused and refusal_reason must equal packet_status.",
    "For missing_evidence, missing_fields must include every packet.missing_fields entry.",
    "brief.owner_id must equal packet.routing.routed_owner_id."
  ]
}
