{"contract_version":"gtm-handoff-brief/1","packet_id":"pkt-100102-5139c008","outcome":"draft","refusal_reason":null,"missing_fields":[],"brief":{"headline":"Larkspur Ltd (GB, MM, 650 employees): VP Sales champion with confirmed budget wants to stop reps rebuilding account context before renewals; decision expected in November.","owner_id":"o-uki-1","context":[{"text":"The contact is Oliver Hughes at Larkspur Ltd, a 650-employee company based in GB. The lead came from outbound.","source_ids":["crm:contact:100102"]},{"text":"Oliver Hughes, VP Sales, is the identified champion.","source_ids":["note:note-7002"]},{"text":"Stated pain: reps rebuild account context before every renewal call.","source_ids":["note:note-7002"]},{"text":"Budget is confirmed.","source_ids":["note:note-7002"]},{"text":"Timeline: a decision is expected in November.","source_ids":["note:note-7002"]},{"text":"Routed under rule R-UKI-SMBMM (EMEA-UKI \u00d7 MM \u2192 o-uki-1).","source_ids":["policy:R-UKI-SMBMM"]}],"suggested_first_touch":"Hi Oliver,\n\nI'm Priya Nair, and I'll be your point of contact at [Company] from here. My understanding is that your reps are rebuilding account context before every renewal call. That costs prep time and makes it easy for things to slip through the cracks.\n\nI'd like to learn how your renewal process runs today: where the account context currently lives, and what a good outcome would look like for your team. Since you're aiming to decide in November, I want to make sure we use the time well and that you have what you need to evaluate us properly.\n\nWould you have 30 minutes this week or next? Happy to work around your calendar.\n\nBest,\nPriya","open_questions":["Who else is involved in the November decision besides Oliver (e.g., economic buyer, RevOps, procurement)?","What is the exact decision date in November, and what steps lead up to it?","Where does account context live today (CRM, call notes, other tools), and what have they tried already?","Roughly what budget has been confirmed, and is it for this specific initiative?","How many reps run renewal calls, and how often do those calls happen?","Are any competing vendors or internal build options under consideration?"]},"cited_source_ids":["crm:contact:100102","note:note-7002","policy:R-UKI-SMBMM"]}
